<?xml version="1.0" encoding="UTF-8" standalone="no"?><game xmlns:xsi="http://www.w3.org/2001/XMLSchema-instance" xsi:noNamespaceSchemaLocation="niveau.xsd">
        <level>1</level>
        <speed>500</speed>
        <player-lives>5</player-lives>

        <best-score>786</best-score>

        <gomes-values>
                <super-gome time="5000">10</super-gome>
                <gome time="3000">3</gome>
                <bonus time="7000">15</bonus>
        </gomes-values>

        <start-positions>
                <pacman x="1" y="2"/>
                <ghost x="1" y="4">inky</ghost>
                <ghost x="4" y="2">pinky</ghost>
                <ghost x="27" y="4">clide</ghost>
                <ghost x="22" y="10">blinky</ghost>
        </start-positions>

        <plateau>
          ■ ■ ■ ■ ■ ■ ■ ■ ■ ■ ■ ■ ■ ■ ■ ■ ■ ■ ■ ■ ■ ■ ■ ■ ■ ■ ■ ■ ■ ■
          ■ N N N N N N N N N N N N N ■ N N N N N N N N N N N N N N ■
          ■ N ■ ■ ■ ■ N ■ ■ ■ ■ ■ ■ N ■ N ■ ■ ■ ■ ■ ■ N ■ ■ ■ ■ ■ N ■
          ■ S ■ ■ ■ ■ N ■ ■ ■ ■ ■ ■ N ■ N ■ ■ ■ ■ ■ ■ N ■ ■ ■ ■ ■ S ■
          ■ N ■ ■ ■ ■ N ■ ■ ■ ■ ■ ■ N ■ N ■ ■ ■ ■ ■ ■ N ■ ■ ■ ■ ■ N ■
          ■ N N N N N N N N N N N N N N N N N N N N N N N N N N N N ■
          ■ N ■ ■ ■ ■ N ■ ■ ■ N ■ ■ ■ ■ ■ ■ ■ N ■ ■ ■ N ■ ■ ■ ■ ■ N ■
          ■ N ■ ■ ■ ■ N ■ ■ ■ N ■ ■ ■ ■ ■ ■ ■ N ■ ■ ■ N ■ ■ ■ ■ ■ N ■
          ■ N N N N N N ■ ■ ■ N N N N N N N N N ■ ■ ■ N N N N N N N ■
          ■ ■ ■ ■ ■ ■ N ■ ■ ■ ■ ■ ■ ■ ■ ■ ■ ■ ■ ■ ■ ■ N ■ ■ ■ ■ ■ ■ ■
          ■ ■ ■ ■ ■ ■ N ■ ■ ■ ■ ■ ■ ■ ■ ■ ■ ■ ■ ■ ■ ■ N ■ ■ ■ ■ ■ ■ ■
          ■ ■ ■ ■ ■ ■ N ■ ■ ■ ■ ■ ■ ■ ■ ■ ■ ■ ■ ■ ■ ■ N ■ ■ ■ ■ ■ ■ ■
          ■ ■ ■ ■ ■ ■ N ■ ■ ■ ■ ■ ■ ■ ■ ■ ■ ■ ■ ■ ■ ■ N ■ ■ ■ ■ ■ ■ ■
          ■ ■ ■ ■ ■ ■ N ■ ■ ■ ■ ■ ■ ■ ■ ■ ■ ■ ■ ■ ■ ■ N ■ ■ ■ ■ ■ ■ ■
          ■ ■ ■ ■ ■ ■ N ■ ■ ■ ■ ■ ■ ■ ■ N N N N N N N N ■ ■ ■ ■ ■ ■ ■
          ■ ■ ■ ■ ■ ■ N N N N N ■ ■ ■ N N ■ ■ N ■ ■ ■ N ■ ■ ■ ■ ■ ■ ■
          ■ ■ ■ ■ ■ ■ N ■ ■ ■ N ■ ■ N S ■ ■ ■ N ■ ■ ■ N ■ ■ ■ ■ ■ ■ ■
          ■ ■ ■ ■ ■ ■ N ■ ■ ■ N N N N ■ ■ ■ ■ N ■ ■ ■ N ■ ■ ■ ■ ■ ■ ■
          ■ ■ ■ ■ ■ ■ N ■ ■ ■ N ■ ■ ■ ■ ■ ■ ■ N ■ ■ ■ N ■ ■ ■ ■ ■ ■ ■
          ■ ■ ■ ■ ■ ■ N ■ ■ ■ N ■ ■ ■ ■ ■ ■ ■ N ■ ■ ■ N ■ ■ ■ ■ ■ ■ ■
          ■ ■ ■ ■ ■ ■ N ■ ■ ■ N ■ ■ ■ ■ ■ ■ ■ N ■ ■ ■ N ■ ■ ■ ■ ■ ■ ■
          ■ N N N N N N ■ ■ ■ N ■ ■ ■ ■ ■ ■ ■ N N N N N N N S N N N ■
          ■ N ■ ■ ■ ■ N ■ ■ ■ N ■ ■ ■ ■ ■ ■ ■ ■ ■ ■ ■ N ■ ■ ■ ■ ■ N ■
          ■ N ■ ■ ■ ■ N ■ ■ ■ N ■ N N N S ■ ■ ■ ■ ■ ■ N ■ ■ ■ ■ ■ N ■
          ■ S ■ ■ ■ ■ N ■ ■ ■ N ■ N ■ ■ N ■ ■ ■ ■ ■ ■ N ■ ■ ■ ■ ■ N ■
          ■ N ■ ■ ■ ■ N ■ ■ ■ N ■ N ■ ■ N ■ ■ ■ ■ ■ ■ N ■ ■ ■ ■ ■ N ■
          ■ N ■ ■ ■ ■ N ■ ■ ■ N ■ N ■ ■ N ■ ■ ■ ■ ■ ■ N ■ ■ ■ ■ ■ N ■
          ■ N ■ ■ ■ ■ N ■ ■ ■ N ■ N ■ ■ N ■ ■ ■ ■ ■ ■ N ■ ■ ■ ■ ■ N ■
          ■ N N N N N N N N N N N N N N N N N N N N N N N N N N N N ■
          ■ ■ ■ ■ ■ ■ ■ ■ ■ ■ ■ ■ ■ ■ ■ ■ ■ ■ ■ ■ ■ ■ ■ ■ ■ ■ ■ ■ ■ ■
        </plateau>
</game>